僕儍儞儖,僞僀僩儖,弌斉幮,挊幰,姰寢,姫悢,俬俽俛俶,扞斣,僐儊儞僩,僐儈噦,嶜悢,楢斣,暋悢,俠俶俷,僕儍儞儖,僞僀僩儖,暃戣,僞僀僩儖僇僫,弌斉幮,弌斉幮僇僫,挊幰,挊幰僇僫,尨嶌幰,嬫暘,僔儕乕僘,嶨帍柤,姰寢,姫悢,敪攧擔,俬俽俛俶,俬俽俛俶侾俁,杮懱壙奿,嶨帍僐乕僪,嫋戻擔,廔椆擔,嫋戻,斕攧儔儞僋,傎傫偺偒傕偪
B1,棎旘棎奜,島択幮,揷拞傎偝側,,9,,,,77284,1,1,,77284,B1,棎旘棎奜,,儔僢僺儔儞僈僀,島択幮,僐僂僟儞僔儍,揷拞傎偝側,僞僫僇儂僒僫,,,僔儕僂僗俲俠,僔儕僂僗,,1,2006/03/23,4-06-373019-0,9784063730197,514,,2006/07/10,,嫋戻,BF,2584
S1,偩傔偰傜偡偝傑丅,彫妛娰,摗栘弐,,3,,,,133295,1,2,,133295,S1,偩傔偰傜偡偝傑丅,,僟儊僥儔僗僒儅,彫妛娰,僔儑僂僈僋僇儞,摗栘弐,僼僕僉僔儏儞,,,彮擭僒儞僨乕僐儈僢僋僗,廡姧彮擭僒儞僨乕,,1,2017/03/17,4-09-127515-X,9784091275158,429,45005-15,2017/04/17,,嫋戻,懠,27002
B1,係俢,島択幮,幀棦,,4,,,,126918,1,3,,126918,B1,係俢,,僼僅乕僨傿乕,島択幮,僐僂僟儞僔儍,幀棦,僔僆儕,媖彯婤,尨嶌,儌乕僯儞僌俲俠,儌乕僯儞僌,,1,2015/12/22,4-06-388544-5,9784063885446,570,42677-44,2016/01/22,,嫋戻,懠,0
B1,埥傞傾儂僂偺堦惗,彫妛娰,僩僂僥儉億乕儖,,3,,,,126130,1,4,,126130,B1,埥傞傾儂僂偺堦惗,,傾儖傾儂僂僲僀僢僔儑僂,彫妛娰,僔儑僂僈僋僇儞,僩僂僥儉億乕儖,僩僂僥儉億乕儖,,,價僢僌僐儈僢僋僗,僸僶僫,,1,2015/10/07,4-09-187248-4,9784091872487,630,45682-48,2015/11/07,,嫋戻,懠,25800
B1,億儔儕僗偼徚偊側偄,僗僋僂僃傾丒僄僯僢僋僗,搱悈偊偗,,3,,,,157589,1,5,,157589,B1,億儔儕僗偼徚偊側偄,,億儔儕僗僴僉僄僫僀,僗僋僂僃傾丒僄僯僢僋僗,僗僋僂僃傾僄僯僢僋僗,搱悈偊偗,僔儅儈僘僄働,,,僈儞僈儞僐儈僢僋僗俰俷俲俤俼,僈儞僈儞俰俷俲俤俼,,1,2022/04/21,4-7575-7888-1,9784757578883,600,48161-82,2022/05/21,,嫋戻,懠,0
S1,戝搹椑,彫妛娰,惣忦恀擇,,3,,,,11001,1,6,,11001,S1,戝搹椑,,僟僀僩僂儕儑僂,彫妛娰,僔儑僂僈僋僇儞,惣忦恀擇,僒僀僕儑僂僔儞僕,,,彮擭僒儞僨乕僐儈僢僋僗,廡姧彮擭僒儞僨乕,,1,2000/12/18,4-09-126131-0,9784091261311,390,,2006/07/01,,嫋戻,懠,0
B1,僷僲儔儅僨儕儏乕僕儑儞,島択幮,彫尨溎巌,,3,,,,80033,1,7,,80033,B1,僷僲儔儅僨儕儏乕僕儑儞,,僷僲儔儅僨儕儏乕僕儑儞,島択幮,僐僂僟儞僔儍,彫尨溎巌,僆僴儔僔儞僕,,,傾僼僞僰乕儞俲俠,傾僼僞僰乕儞,,1,2007/03/23,4-06-314446-1,9784063144468,590,55723-46,2007/04/23,,嫋戻,BF,6356
S1,偑傫偽傞両僗僩乕僇乕,島択幮,埳摗峀柧,,3,,,,120422,1,8,,120422,S1,偑傫偽傞両僗僩乕僇乕,,僈儞僶儖僗僩乕僇乕,島択幮,僐僂僟儞僔儍,埳摗峀柧,僀僩僂僸儘傾僉,,,廡儅僈俲俠,暿嶜彮擭儅僈僕儞,,1,2014/09/09,4-06-395180-4,9784063951806,429,42279-80,,,,懠,24062
S2,僴儘乕両棟巕,島択幮,幝嶈傑偙偲,,3,,,,59789,1,9,,59789,S2,僴儘乕両棟巕,,僴儘乕儕僐,島択幮,僐僂僟儞僔儍,幝嶈傑偙偲,僔僲僓僉儅僐僩,,,俛俤 俴俷倁俤 俲俠,俛俤 俴俷倁俤,,1,2002/06/11,4-06-319060-9,9784063190601,429,,2006/12/01,,嫋戻,懠,0
B1,儕償傽僀傾僒儞,儊僨傿傾儚乕僋僗,堖扟梀,,12,,,,6972,1,10,,6972,B1,儕償傽僀傾僒儞,,儕僶僀傾僒儞,儊僨傿傾儚乕僋僗,僇僪僇儚傾僗僉乕儊僨傿傾儚乕僋僗,堖扟梀,僉僰僞僯儐僂,,,Dengeki Comics,揹寕僐儈僢僋僈僆,,1,1999/11,4-8402-1347-X,9784840213479,550,,,,,BF,2219
S1,僈僽儕儞,島択幮,彫椦傑偙偲,,3,,,,78285,1,11,,78285,S1,僈僽儕儞,,僈僽儕儞,島択幮,僐僂僟儞僔儍,彫椦傑偙偲,僐僶儎僔儅僐僩,,,儃儞儃儞俲俠,僐儈僢僋僗儃儞儃儞,,1,2006/10/06,4-06-332058-8,9784063320589,390,45552-58,2006/12/01,,嫋戻,懠,6013
B1,埨忛偝傫偺妛峑偺曐寬幒偺彫杚愭惗,彮擭夋曬幮,埢悪偮偽偒,,3,,,,149584,1,12,,149584,B1,埨忛偝傫偺妛峑偺曐寬幒偺彫杚愭惗,,傾儞僕儑僂僒儞僲僈僢僐僂僲儂働儞僔僣僲僐儅僉僙儞僙僀,彮擭夋曬幮,僔儑僂僱儞僈儂僂僔儍,埢悪偮偽偒,傾儎僗僊僣僶僉,壛摗梇堦,尨嶌,倄俲僐儈僢僋僗,儎儞僌僉儞僌,,1,2020/07/13,4-7859-6709-9,9784785967093,650,50057-60,2020/10/06,,嫋戻,懠,0
B1,儖億儖僞乕僕儏,尪搤幧,攧栰婡巕,,3,,,,134495,1,13,,134495,B1,儖億儖僞乕僕儏,,儖億儖僞乕僕儏,尪搤幧,僎儞僩僂僔儍,攧栰婡巕,僂儕僲僉僐,,,僶乕僘僐儈僢僋僗,僐儈僢僋僶乕僘,,1,2017/06/24,4-344-84004-6,9784344840041,630,54258-57,,,,懠,27445
S1,僼儖僗儁僢僋,島択幮,娭岥懢榊,,4,,,,76237,1,14,,76237,S1,僼儖僗儁僢僋,,僼儖僗儁僢僋,島択幮,僐僂僟儞僔儍,娭岥懢榊,僙僉僌僠僞儘僂,,,廡姧儅僈僕儞俲俠,廡姧彮擭儅僈僕儞,,1,2005/11/17,4-06-363603-8,9784063636031,390,42264-03,2006/11/06,,嫋戻,懠,2974
B1,儂僇儀儞,島択幮,僇儚儔僯僒僀,,6,,,,69505,1,15,,69505,B1,儂僇儀儞,,儂僇儀儞,島択幮,僐僂僟儞僔儍,僇儚儔僯僒僀,僇儚儔僯僒僀,拞搱攷峴,尨嶌,僀僽僯儞僌俲俠,僀僽僯儞僌,,1,2003/10/23,4-06-352042-0,9784063520422,514,,2006/12/01,,嫋戻,BF,7180
B2,嬂垽僇僞僗僩儘僼傿,俲俙俢俷俲俙倂俙乮俙俵倂乯,戓僴儖懢,,3,,,,121846,1,16,,121846,B2,嬂垽僇僞僗僩儘僼傿,,僉儑僂傾僀僇僞僗僩儘僼傿,俲俙俢俷俲俙倂俙乮俙俵倂乯,僇僪僇儚傾僗僉乕儊僨傿傾儚乕僋僗,戓僴儖懢,儅儐僘儈僴儖僞,,,僔儖僼僐儈僢僋僗,,,1,2014/12/20,4-04-869126-0,9784048691260,580,201412-068,,,,懠,24715
B1,昉媨偝傫偺拞偺恖,儚僯僽僢僋僗,崟愳偄偯傒,,5,,,,99816,1,17,,99816,B1,昉媨偝傫偺拞偺恖,,僸儊儈儎僒儞僲僫僇僲僸僩,儚僯僽僢僋僗,儚僯僽僢僋僗,崟愳偄偯傒,僋儘僇儚僀僤儈,寧尒憪暯,尨嶌,俧倀俵丂俠俷俵俬俠俽丂俹倢倳倱,,,1,2010/07/24,4-8470-3739-1,9784847037399,620,201007-200,,,,BF,14667
B2,僾儕乕僘丄僕乕償僗,敀愹幮,彑揷暥,,3,,,,89857,1,18,,89857,B2,僾儕乕僘丄僕乕償僗,,僾儕乕僘僕乕償僗,敀愹幮,僴僋僙儞僔儍,彑揷暥,僇僣僞僽儞,俹丏俧丏倂倧倓倕倛倧倳倱倕,尨嶌,壴偲備傔僐儈僢僋僗僗儁僔儍儖,儊儘僨傿,,1,2009/03/05,4-592-18693-1,9784592186939,590,43788-11,,,,BG,13967
S1,僼傽儞僔乕嶨媄抍,彫妛娰,崟梩弫堦,,3,,,,31237,1,19,,31237,S1,僼傽儞僔乕嶨媄抍,,僼傽儞僔乕僓僣僊僟儞,彫妛娰,僔儑僂僈僋僇儞,崟梩弫堦,僋儘僶僕儏儞僀僠,,,彮擭僒儞僨乕僐儈僢僋僗,廡姧彮擭僒儞僨乕,,1,1998/02,4-09-125361-X,9784091253613,390,,,,,SZ,3888
B1,僟僂僫乕宯偍巓偝傫偵枅擔僇僗偺塕傪棳偟崬傑傟傞榖,俲俙俢俷俲俙倂俙乮俵俥乯,惗憅偺傦傞,,3,,,,170928,1,20,,170928,B1,僟僂僫乕宯偍巓偝傫偵枅擔僇僗偺塕傪棳偟崬傑傟傞榖,,僟僂僫乕働僀僆僱僄僒儞僯儅僀僯僠僇僗僲僂僜儝僫僈僔僐儅儗儖僴僫僔,俲俙俢俷俲俙倂俙乮俵俥乯,僇僪僇儚儊僨傿傾僼傽僋僩儕乕,惗憅偺傦傞,僫儅僋儔僲僄儖,偼傞偽乕偳壆,尨嶌,俵俥俠,,,1,2025/02/21,4-04-684469-8,9784046844699,680,202502-547,,,,懠,0
B1,擫偼傛傒偑偊傞,島択幮,崅嫶隳攏,,3,,,,131041,1,21,,131041,B1,擫偼傛傒偑偊傞,,僱僐僴儓儈僈僄儖,島択幮,僐僂僟儞僔儍,崅嫶隳攏,僞僇僴僔僔儑僂儅,嶰愇儊僈僱,尨埬,儎儞儅僈俲俠俽俹,,,1,2016/10/20,4-06-382870-0,9784063828702,602,42547-70,2016/11/20,,嫋戻,懠,25557
S1,傾僂僩僐乕僪 挻忢斊嵾摿柋憑嵏姱,島択幮,楅梾栘偐傝傫,,3,,,,87325,1,22,,87325,S1,傾僂僩僐乕僪 挻忢斊嵾摿柋憑嵏姱,,傾僂僩僐乕僪僠儑僂僕儑僂僴儞僓僀僩僋儉僜僂僒僇儞,島択幮,僐僂僟儞僔儍,楅梾栘偐傝傫,僗僘儔僊僇儕儞,昉僲庽惏旻,尨嶌,儔僀僶儖俲俠,彮擭儔僀僶儖,,1,2008/11/04,4-06-380015-6,9784063800159,400,43550-15,2008/12/04,,嫋戻,SF,9023
B1,僷僠僗儘傂偲傝椃僑乕儖僪,敀栭彂朳,墱揷宬棾,,3,,,,69212,1,23,,69212,B1,僷僠僗儘傂偲傝椃僑乕儖僪,,僷僠僗儘僸僩儕僞價,敀栭彂朳,價儍僋儎僔儑儃僂,墱揷宬棾,僆僋僟働僀儕儏僂,,,敀栭僐儈僢僋僗154,,,1,2003/09/19,4-89367-892-2,9784893678928,552,,,,,懠,0
B1,儀僗僥傿傾乣棳寧彺姰慡斉乣,島択幮,抮忋椛堦,,4,,,,72683,1,24,,72683,B1,儀僗僥傿傾乣棳寧彺姰慡斉乣,,儀僗僥傿傾儕儏僂僎僣僔儑僂,島択幮,僐僂僟儞僔儍,抮忋椛堦,僀働僈儈儕儑僂僀僠,,,儌乕僯儞僌俲俠,儌乕僯儞僌,,1,2004/10/22,4-06-334925-X,9784063349252,743,,2005/07/11,,嫋戻,懠,0
B1,揝巕偺堢偰曽,島択幮,偐傢偡傒傂傠偟,,3,,,,119617,1,25,,119617,B1,揝巕偺堢偰曽,,僥僣僐僲僜僟僥僇僞,島択幮,僐僂僟儞僔儍,偐傢偡傒傂傠偟,僇儚僗儈僸儘僔,傗傑傕傝暥梇,婇夋,儎儞儅僈俲俠俽俹,寧姧儎儞僌儅僈僕儞,,1,2014/07/23,4-06-382493-4,9784063824933,565,42543-93,2014/08/23,,嫋戻,懠,23790
B1,懢梲偺僪儘僢僾僉僢僋偲寧偺僗乕僾儗僢僋僗,島択幮,棊崌桾夘,,3,,,,71618,1,26,,71618,B1,懢梲偺僪儘僢僾僉僢僋偲寧偺僗乕僾儗僢僋僗,,僞僀儓僂僲僪儘僢僾僉僢僋僩僣僉僲僗乕僾儗僢僋僗,島択幮,僐僂僟儞僔儍,棊崌桾夘,僆僠傾僀儐僂僗働,,,儌乕僯儞僌俲俠,儌乕僯儞僌,,1,2004/05/21,4-06-328951-6,9784063289510,524,,,,,懠,0
B1,儕僩儖僶僗僞乕僘両俤値倓 倧倖 俼倕倖倰倎倝値,俲俙俢俷俲俙倂俙乮俙俵倂乯,倅俤俶,,4,,,,113156,1,27,,113156,B1,儕僩儖僶僗僞乕僘両俤値倓 倧倖 俼倕倖倰倎倝値,,儕僩儖僶僗僞乕僘僄儞僪僆僽儕僼儗僀儞,俲俙俢俷俲俙倂俙乮俙俵倂乯,僇僪僇儚傾僗僉乕儊僨傿傾儚乕僋僗,倅俤俶,僛儞,俲倕倷,,揹寕僐儈僢僋僗,,,1,2013/03/27,4-04-891435-9,9784048914352,570,49066-23,,,,懠,20892
B1,懍峌惗搆夛,島択幮,彫愳夒巎,,3,,,,52792,1,28,,52792,B1,懍峌惗搆夛,,僜僢僐僂僙僀僩僇僀,島択幮,僐僂僟儞僔儍,彫愳夒巎,僆僈儚儅僒僔,,,傾僼僞僰乕儞俲俠,傾僼僞僰乕儞,,1,2001/08/23,4-06-321125-8,9784063211252,480,,,,,BF,3175
B1,僔僲僊僑儘僔 乣埮壱嬈巇抲恖乣,廐揷彂揦,偄傢傗峎,,3,,,,127746,1,29,,127746,B1,僔僲僊僑儘僔 乣埮壱嬈巇抲恖乣,,僔僲僊僑儘僔,廐揷彂揦,傾僉僞僔儑僥儞,偄傢傗峎,僀儚儎傾僉儔,嶳揷堦暥,尨嶌,僠儍儞僺僆儞俼俤俢僐儈僢僋僗,僠儍儞僺僆儞俼俤俢,,1,2016/02/19,4-253-23705-3,9784253237055,562,44946-08,2016/03/19,,嫋戻,懠,0
B1,倅乣僛僢僩乣,擔杮暥寍幮,憡尨僐乕僕,,3,,,,113699,1,30,,113699,B1,倅乣僛僢僩乣,,僛僢僩,擔杮暥寍幮,僯儂儞僽儞僎僀僔儍,憡尨僐乕僕,傾僀僴儔僐乕僕,,,僯僠僽儞丒僐儈僢僋僗,暿嶜枱夋僑儔僋,,1,2013/04/26,4-537-13023-7,9784537130232,590,52974-67,2013/05/26,,嫋戻,懠,21082
B1,嬛椔榋嬫 僐乕僪丒傾儉儕僞,彫妛娰僋儕僄僀僥傿僽,廐廳妛,,3,,,,134154,1,31,,134154,B1,嬛椔榋嬫 僐乕僪丒傾儉儕僞,,僉儞儕儑僂儘僢僋僐乕僪傾儉儕僞,彫妛娰僋儕僄僀僥傿僽,僔儑僂僈僋僇儞僋儕僄僀僥傿僽,廐廳妛,傾僉僔僎儅僫僽,怷嫶價儞僑,尨嶌,僸乕儘乕僘僐儈僢僋僗,,,1,2017/05/02,4-86468-500-2,9784864685009,560,52032-01,2017/06/07,,嫋戻,懠,27309
S2,偙偄偮傜侾侽侽亾揱愢,廤塸幮,壀揷偁乣傒傫,,3,,,,3272,1,32,,3272,S2,偙偄偮傜侾侽侽亾揱愢,,僐僀僣儔僸儍僋僷乕僙儞僩僨儞僙僣,廤塸幮,僔儏僂僄僀僔儍,壀揷偁乣傒傫,僆僇僟傾乕儈儞,,,傝傏傫儅僗僐僢僩僐儈僢僋僗,,,1,1990/07/13,4-08-853530-8,9784088535302,390,43215-30,2006/01/01,,嫋戻,懠,1558
S1,怱棟憑嵏姱憪撱埁,廤塸幮,寧搰孫,,3,,,,10052,1,33,,10052,S1,怱棟憑嵏姱憪撱埁,,僔儞儕僜僂僒僇儞僋僒僫僊傾僆僀,廤塸幮,僔儏僂僄僀僔儍,寧搰孫,僣僉僔儅僇僆儖,,,僕儍儞僾僐儈僢僋僗,廡姧彮擭僕儍儞僾,,1,1997/01/10,4-08-872303-1,9784088723037,388,,,,,懠,0
S1,僗僩儔僀僇乕両桬婥,廤塸幮,偲傕側偑傂偱偒,,3,,,,63679,1,34,,63679,S1,僗僩儔僀僇乕両桬婥,,僗僩儔僀僇乕儐僂僉,廤塸幮,僔儏僂僄僀僔儍,偲傕側偑傂偱偒,僩儌僫僈僸僨僉,,,僕儍儞僾僗乕僷乕僐儈僢僋僗,僗乕僷乕僕儍儞僾,,1,,4-420-13195-0,9784420131957,0,,,,,懠,0
S1,倂俙俼俙俽俫俬,島択幮,帥戲戝夘,,4,,,,27629,1,35,,27629,S1,倂俙俼俙俽俫俬,,儚儔僔,島択幮,僐僂僟儞僔儍,帥戲戝夘,僥儔僒儚僟僀僗働,,,廡姧儅僈僕儞俲俠,廡姧彮擭儅僈僕儞,,1,1990/12/12,4-06-311626-3,9784063116267,379,,2006/12/01,,嫋戻,懠,0
S1,僼傽僀丒僽儗僀儞乣嵟婜偺僷僘儖乣,島択幮,忋栰弔惗,,3,,,,104640,1,36,,104640,S1,僼傽僀丒僽儗僀儞乣嵟婜偺僷僘儖乣,,僼傽僀僽儗僀儞乣僒僀僑僲僷僘儖乣,島択幮,僐僂僟儞僔儍,忋栰弔惗,僂僄僲僴儖僉,怷崅梉師,峔惉,廡儅僈俲俠,廡姧彮擭儅僈僕儞,,1,2011/07/15,4-06-384527-3,9784063845273,407,42273-27,2011/08/15,2011/12/26,,SC,16835
B1,俿俼俬俛俙俴侾俀,島択幮,挿揷桰岾,,3,,,,82477,1,37,,82477,B1,俿俼俬俛俙俴侾俀,,僩儔僀僶儖僩僂僄儖僽,島択幮,僐僂僟儞僔儍,挿揷桰岾,僆僒僟儐僂僐僂,,,俲俠俢倃,儅僈僕儞僗儁僔儍儖,,1,2007/10/17,4-06-363908-8,9784063639087,514,46297-82,2007/11/17,,嫋戻,BF,6352
B1,婡摦愴巑僈儞僟儉俽俤俤俢 俢俤俽俿俬俶倄,島択幮,崅嶳悙曚,,4,,,,73413,1,38,,73413,B1,婡摦愴巑僈儞僟儉俽俤俤俢 俢俤俽俿俬俶倄,,僉僪僂僙儞僔僈儞僟儉僔乕僪僨僗僥傿僯傿,島択幮,僐僂僟儞僔儍,崅嶳悙曚,僞僇儎儅儈僘儂,,,俲俠俢倃,儅僈僕儞倅,,1,2005/01/17,4-06-334964-0,9784063349641,505,,,,,懠,0
S1,嬻庤傾儂堦戙栚嫮偔惉傝忋偑傟,島択幮,戲揷傂傠傆傒,,3,,,,60404,1,39,,60404,S1,嬻庤傾儂堦戙栚嫮偔惉傝忋偑傟,,僇儔僥傾儂僀僠僟僀,島択幮,僐僂僟儞僔儍,戲揷傂傠傆傒,僒儚僟僸儘僼儈,,,廡姧儅僈僕儞俲俠,廡姧彮擭儅僈僕儞,,1,1993/08/06,4-06-311932-7,9784063119329,379,,2006/12/01,,嫋戻,SZ,3565
B1,俙俲俬俛俙乫俽 俿俼俬俹,俲俙俢俷俲俙倂俙乮俙俵倂乯,悈揷働儞僕,,3,,,,110741,1,40,,110741,B1,俙俲俬俛俙乫俽 俿俼俬俹,,傾僉僶僘僩儕僢僾,俲俙俢俷俲俙倂俙乮俙俵倂乯,僇僪僇儚傾僗僉乕儊僨傿傾儚乕僋僗,悈揷働儞僕,儈僘僞働儞僕,傾僋儚僀傾,,揹寕僐儈僢僋僗,,,1,2012/09/27,4-04-886917-5,9784048869171,570,49065-36,,,,懠,19734
B1,椱棡偺攇晽,島択幮,偐傢偖偪偐偄偠,,4,,,,37929,1,41,,37929,B1,椱棡偺攇晽,,儖儕僲僫儈僇僛,島択幮,僐僂僟儞僔儍,偐傢偖偪偐偄偠,僇儚僌僠僇僀僕,,,儌乕僯儞僌俲俠,儌乕僯儞僌,,1,1998/12/16,4-06-328610-X,9784063286106,505,,2006/12/01,,嫋戻,BZ,4023
B1,尰戙杺彈恾娪,堦恦幮,埳嶇僂僞,,5,,,,119292,1,42,,119292,B1,尰戙杺彈恾娪,,僎儞僟僀儅僕儑僘僇儞,堦恦幮,僀僠僕儞僔儍,埳嶇僂僞,僀僒僉僂僞,,,俬俢僐儈僢僋僗乛俼俤倃僐儈僢僋僗,,,1,2014/06/27,4-7580-6452-0,9784758064521,574,50675-55,,,,懠,23641
B1,俽俇侽僠儖僪儗儞,島択幮,愳敤憦堦榊,,4,,,,70927,1,43,,70927,B1,俽俇侽僠儖僪儗儞,,僔儑僂儚僔僢僋僗僥傿僠儖僪儗儞,島択幮,僐僂僟儞僔儍,愳敤憦堦榊,僇儚僶僞僜僂僀僠儘僂,,,僀僽僯儞僌俲俠,僀僽僯儞僌,,1,2004/02/23,4-06-352058-7,9784063520583,514,,2005/07/24,,嫋戻,懠,0
S1,俙倗倕両,島択幮,戝杮寋,,4,,,,26087,1,44,,26087,S1,俙倗倕両,,僄僀僕,島択幮,僐僂僟儞僔儍,戝杮寋,僆僆儌僩僯儚僩儕,,,寧姧儅僈僕儞俲俠,寧姧彮擭儅僈僕儞,,1,1997/04/15,4-06-333569-0,9784063335699,390,,2006/12/01,2020/03/23,,懠,0
S1,儁儞僊儞柡,廐揷彂揦,崅嫶偰偮傗,,3,,,,79629,1,45,,79629,S1,儁儞僊儞柡,,儁儞僊儞儉僗儊,廐揷彂揦,傾僉僞僔儑僥儞,崅嫶偰偮傗,僞僇僴僔僥僣儎,,,彮擭僠儍儞僺僆儞僐儈僢僋僗,廡姧彮擭僠儍儞僺僆儞,,1,2007/02/08,4-253-20941-6,9784253209410,400,40093-74,2007/03/08,,嫋戻,SF,5993
B1,愴崙愴弍愴婰 俴俷俛俷俽,島択幮,廐嶳柧巕,,5,,,,81823,1,46,,81823,B1,愴崙愴弍愴婰 俴俷俛俷俽,,儘儃僗,島択幮,僐僂僟儞僔儍,廐嶳柧巕,傾僉儎儅傾僉僐,,,僔儕僂僗俲俠,僔儕僂僗,,1,2007/08/23,4-06-373084-0,9784063730845,533,42830-84,2007/09/23,,嫋戻,BF,9567
B1,墛偺僀儞僼僃儖僲,僉儖僞僀儉僐儈儏僯働乕僔儑儞,嬥岝玳,,6,,,,83461,1,47,,83461,B1,墛偺僀儞僼僃儖僲,,儂僲僆僲僀儞僼僃儖僲,僉儖僞僀儉僐儈儏僯働乕僔儑儞,僉儖僞僀儉僐儈儏僯働乕僔儑儞,嬥岝玳,僉儉僋傽儞僸儑儞,,,償傽儖僉儕乕僐儈僢僋僗,,,1,2008/01/31,4-86032-525-7,9784860325251,552,200801-051,,,,BF,0
B1,敱,彮擭夋曬幮,桍撪戝庽,,4,,,,174205,1,48,,174205,B1,敱,,僶僣,彮擭夋曬幮,僔儑僂僱儞僈儂僂僔儍,桍撪戝庽,儎僫僂僠僟僀僕儏,,,倄俲僐儈僢僋僗,儎儞僌僉儞僌俛倀俴俴,楢嵹拞,1,2025/10/27,4-7859-8051-6,9784785980511,720,50071-16,,,,懠,0
B2,惵擭偺偨傔偺撉彂僋儔僽,傎傞傉弌斉,僞僇僴僔儅僐,,3,,,,88811,1,49,,88811,B2,惵擭偺偨傔偺撉彂僋儔僽,,僙僀僱儞僲僞儊僲僪僋僔儑僋儔僽,傎傞傉弌斉,儂儖僾僔儏僢僷儞,僞僇僴僔儅僐,僞僇僴僔儅僐,,,僼儗僢僋僗僐儈僢僋僗丂僼儗傾,,,1,2009/01/09,4-7973-5215-9,9784797352153,560,200901-118,,,,BG,13558
B2,峕屗儌傾僛儖,尪搤幧,僉儕僄,,3,,,,115986,1,50,,115986,B2,峕屗儌傾僛儖,,僄僪儌傾僛儖,尪搤幧,僎儞僩僂僔儍,僉儕僄,僉儕僄,,,僶乕僘僐儈僢僋僗丂僗僺僇僐儗僋僔儑儞,,,1,2013/10/24,4-344-82944-1,9784344829442,619,54254-13,,,,懠,22113
S1,僗僲乕僪儖僼傿儞,島択幮,戝愇抦嵠,,4,,,,29861,1,51,,29861,S1,僗僲乕僪儖僼傿儞,,僗僲乕僪儖僼傿儞,島択幮,僐僂僟儞僔儍,戝愇抦嵠,僆僆僀僔僩儌儎,,,廡姧儅僈僕儞俲俠,廡姧彮擭儅僈僕儞,,1,2000/01/14,4-06-312796-6,9784063127966,390,,,,,懠,0
S1,巖椞堟,島択幮,戝慜婱巎,,3,,,,136481,1,52,,136481,S1,巖椞堟,,僔僇僶僱儕儑僂僀僉,島択幮,僐僂僟儞僔儍,戝慜婱巎,僆僆儅僄僞僇僼儈,,,廡儅僈俲俠,,,1,2017/11/09,4-06-510383-5,9784065103838,429,42288-58,2017/12/09,,嫋戻,懠,28361
B1,晽椦壩浳,島択幮,彫愳夒巎,,3,,,,37066,1,53,,37066,B1,晽椦壩浳,,僼僂儕儞僇僓儞,島択幮,僐僂僟儞僔儍,彫愳夒巎,僆僈儚儅僒僔,,,傾僼僞僰乕儞俲俠,傾僼僞僰乕儞,,1,1999/08,4-06-321101-0,9784063211016,467,,,,,懠,0
B1,僟儞僗 僀儞 僓 償傽儞僷僀傾僶儞僪 僗儗僢僕丒僴儅乕偺捛壇,俲俙俢俷俲俙倂俙乮俵俥乯,娐朷,,3,,,,113356,1,54,,113356,B1,僟儞僗 僀儞 僓 償傽儞僷僀傾僶儞僪 僗儗僢僕丒僴儅乕偺捛壇,,僟儞僗僀儞僓僶儞僷僀傾僶儞僪僗儗僢僕僴儅乕僲僣僀僆僋,俲俙俢俷俲俙倂俙乮俵俥乯,僇僪僇儚儊僨傿傾僼傽僋僩儕乕,娐朷,僞儅僉僲僝儉,,,俵俥僐儈僢僋僗丂僼儔僢僷乕僔儕乕僘,僼儔僢僷乕,,1,2013/03/23,4-8401-5038-9,9784840150385,552,52654-38,,,,懠,20843
B2,俫倧倢倷 俲値倝倗倛倲,僕乕僆乕僥傿乕,媨嶈杸栯,,4,,,,104684,1,55,,104684,B2,俫倧倢倷 俲値倝倗倛倲,,儂乕儕乕僫僀僩,僕乕僆乕僥傿乕,僕乕僆乕僥傿乕,媨嶈杸栯,儈儎僓僉儅儎,,,僉儍僲僾儕俠俷俵俬俠俽,,,1,2011/07/23,4-86084-748-2,9784860847487,600,201107-159,,,,BG,0
B1,楾偼柊傜側偄,俲俙俢俷俲俙倂俙乮妏愳乯,怴愳尃暫塹,,3,,,,145255,1,56,,145255,B1,楾偼柊傜側偄,,僆僆僇儈僴僱儉儔僫僀,俲俙俢俷俲俙倂俙乮妏愳乯,僇僪僇儚僇僪僇儚僔儑僥儞,怴愳尃暫塹,僔儞僇儚僑儞儀僄,巟墖俛俬俽,尨嶌,僇僪僇儚僐儈僢僋僗俙,,,1,2019/08/02,4-04-108494-6,9784041084946,620,201908-034,2019/09/03,2025/08/02,,懠,0
S1,儐乕僩,廤塸幮,壨栰宑,,3,,,,74983,1,57,,74983,S1,儐乕僩,,儐乕僩,廤塸幮,僔儏僂僄僀僔儍,壨栰宑,僇儚僲働僀,,,僕儍儞僾僐儈僢僋僗,廡姧彮擭僕儍儞僾,,1,2005/07/04,4-08-873835-7,9784088738352,390,42980-35,2006/01/01,,嫋戻,懠,1588
B1,俙倰倕 倷倧倳 俙倢倝們倕丠,堦恦幮,曅嬎偄偔傒,,12,,,,95453,1,58,,95453,B1,俙倰倕 倷倧倳 俙倢倝們倕丠,,傾乕儐乕傾儕僗,堦恦幮,僀僠僕儞僔儍,曅嬎偄偔傒,僇僞僊儕僀僋儈,擇媨垽,尨嶌,俬俢僐儈僢僋僗乛倅俤俼俷亅俽倀俵僐儈僢僋僗,倅俤俼俷亅俽倀俵,,1,2009/12/25,4-7580-5470-3,9784758054706,552,50662-29,,,,BF,11789
B1,儅僀僫僗,彫妛娰,壂偝傗偐,,5,,,,6263,1,59,,6263,B1,儅僀僫僗,,儅僀僫僗,彫妛娰,僔儑僂僈僋僇儞,壂偝傗偐,僆僉僒儎僇,,,儎儞僌僒儞僨乕僐儈僢僋僗,儎儞僌僒儞僨乕,,1,1996/07/05,4-09-151781-1,9784091517814,485,,,,,BF,4263
B1,儔僢僷乕偵姎傑傟偨傜儔僢僷乕偵側傞枱夋,擔斕傾僀丒僺乕丒僄僗,僀儞僇掗崙,,3,,,,136742,1,60,,136742,B1,儔僢僷乕偵姎傑傟偨傜儔僢僷乕偵側傞枱夋,,儔僢僷乕僯僇儅儗僞儔儔僢僷乕僯僫儖儅儞僈,擔斕傾僀丒僺乕丒僄僗,僯僢僷儞傾僀僺乕僄僗,僀儞僇掗崙,僀儞僇僥僀僐僋,,,,,,1,2017/11/15,4-908588-34-1,9784908588341,540,201711-300,2017/12/15,,嫋戻,懠,28490
S1,攧偭偨傟僟僀僉僠両,彫妛娰,晲懞桬帯,,4,,,,69108,1,61,,69108,S1,攧偭偨傟僟僀僉僠両,,僂僢僞儗僟僀僉僠,彫妛娰,僔儑僂僈僋僇儞,晲懞桬帯,僞働儉儔儐僂僕,,,彮擭僒儞僨乕僐儈僢僋僗,廡姧彮擭僒儞僨乕,,1,2003/09/18,4-09-126681-9,9784091266811,390,45096-81,2006/07/01,,嫋戻,SZ,0
S1,幾晽偺僗僩儔,島択幮,娾揷僫儝儎,,4,,,,119195,1,62,,119195,S1,幾晽偺僗僩儔,,僕儍僼僂僲僗僩儔,島択幮,僐僂僟儞僔儍,娾揷僫儝儎,僀儚僞僫儝儎,,,廡儅僈俲俠,,,1,2014/06/09,4-06-395099-9,9784063950991,429,42278-99,2014/10/10,,嫋戻,懠,23522
S1,妛墍忣曬晹俫俬俹,廤塸幮,晉戲弴,,3,,,,50873,1,63,,50873,S1,妛墍忣曬晹俫俬俹,,僈僋僄儞僕儑僂儂僂僽僄僀僠傾僀僺乕,廤塸幮,僔儏僂僄僀僔儍,晉戲弴,僩儈僓儚僕儏儞,,,僕儍儞僾僐儈僢僋僗,廡姧彮擭僕儍儞僾,,1,1986/01/10,4-08-852166-8,9784088521664,360,43030-46,2006/01/01,,嫋戻,懠,0
B1,傾僒儖僩丒傾僨傿僋僩倶俼,彫妛娰,僗僘僉桞抦,,3,,,,170213,1,64,,170213,B1,傾僒儖僩丒傾僨傿僋僩倶俼,,傾僒儖僩傾僨傿僋僩僋儘僗傾乕儖,彫妛娰,僔儑僂僈僋僇儞,僗僘僉桞抦,僗僘僉僞僟僩儌,,,僒儞僨乕俧倃僐儈僢僋僗,僒儞僨乕俧倃,楢嵹拞,1,2024/12/19,4-09-157849-7,9784091578495,700,44058-49,2025/01/19,,嫋戻,懠,0
B1,偮傞偮傞偲僓儔僓儔偺娫,島択幮,寧巕,,4,,,,114685,1,65,,114685,B1,偮傞偮傞偲僓儔僓儔偺娫,,僣儖僣儖僩僓儔僓儔僲傾僀僟,島択幮,僐僂僟儞僔儍,寧巕,僣僉僐,,,傾僼僞僰乕儞俲俠,,,1,2013/07/23,4-06-387905-4,9784063879056,552,55730-05,2013/08/23,,嫋戻,懠,21577
B1,儘儃偲偆偝媑,島択幮,壛摗榓宐,,5,,,,76447,1,66,,76447,B1,儘儃偲偆偝媑,,儘儃僩僂僒僉僠,島択幮,僐僂僟儞僔儍,壛摗榓宐,僇僩僂僇僘僄,,,僔儕僂僗俲俠,僔儕僂僗,,1,2005/12/22,4-06-373001-8,9784063730012,514,,2006/12/01,,嫋戻,懠,6361
