ジャンル,タイトル,出版社,著者,完結,巻数,ＩＳＢＮ,棚番,コメント,コミ№,冊数,連番,複数,ＣＮＯ,ジャンル,タイトル,副題,タイトルカナ,出版社,出版社カナ,著者,著者カナ,原作者,区分,シリーズ,雑誌名,完結,巻数,発売日,ＩＳＢＮ,ＩＳＢＮ１３,本体価格,雑誌コード,許諾日,終了日,許諾,販売ランク,ほんのきもち
B1,威圧感◎ 戦闘系チート持ちの成り上がらない村人スローライフ,スクウェア・エニックス,戌飼ゐぬゐ,,3,,,,156042,1,56,,156042,B1,威圧感◎ 戦闘系チート持ちの成り上がらない村人スローライフ,,イアツカンニジュウマル,スクウェア・エニックス,スクウェアエニックス,戌飼ゐぬゐ,イヌカイイヌイ,日之浦拓,原作,ＧＣＵＰ！,,,1,2021/12/07,4-7575-7614-5,9784757576148,600,48149-65,2022/01/07,,許諾,他,0
B2,悪役令嬢はオジサマに夢中です,幻冬舎,落槻あれれ,,3,,,,156520,1,57,,156520,B2,悪役令嬢はオジサマに夢中です,,アクヤクレイジョウハオジサマニムチュウデス,幻冬舎,ゲントウシャ,落槻あれれ,オチツキアレレ,翡翠,原作,バーズコミックス,,,1,2022/01/24,4-344-84975-2,9784344849754,650,54263-61,2022/10/24,,許諾,他,0
B1,俺だけ選び放題、Ｓ級レアアイテムも壊れスキルも覚醒した【シュレディンガーの猫】で思うがまま！,双葉社,佐野マコト,,3,,,,155895,1,58,,155895,B1,俺だけ選び放題、Ｓ級レアアイテムも壊れスキルも覚醒した【シュレディンガーの猫】で思うがまま！,,オレダケエラビホウダイエスキュウレアアイテムモコワレスキルモカクセイシタシュレディンガーノネコデオモウガママ,双葉社,フタバシャ,佐野マコト,サノマコト,ぺもぺもさん,原作,モンスターコミックス,,,1,2021/11/29,4-575-41324-0,9784575413243,640,202111-278,2021/12/30,,許諾,他,0
B1,十三番目の転生者〜俺だけ見捨てた女神をぶっ飛ばす！〜,集英社,小林煌,,4,,,,160990,1,59,,160990,B1,十三番目の転生者〜俺だけ見捨てた女神をぶっ飛ばす！〜,,ジュウサンバンメノテンセイシャ,集英社,シュウエイシャ,小林煌,コバヤシキラ,日之影ソラ,原作,ヤングジャンプコミックス,,,1,2023/01/19,4-08-892574-2,9784088925745,650,44299-74,2023/02/19,,許諾,他,0
B1,最強無敵の美少女賢者たちが、オレの師匠になりたがる,小学館,一ノ瀬隆,,3,,,,161149,1,60,,161149,B1,最強無敵の美少女賢者たちが、オレの師匠になりたがる,,ビショウジョケンジャ,小学館,ショウガクカン,一ノ瀬隆,イチノセリュウ,ｋｔ６０,原作,ビッグコミックス,,,1,2023/01/12,4-09-861616-5,9784098616169,650,58616-16,2023/02/12,,許諾,他,0
B1,最後の竜騎士の英雄譚 パンジャール猟兵団戦記,ＫＡＤＯＫＡＷＡ（ＭＦ）,蒼木雅彦,,3,,,,161444,1,61,,161444,B1,最後の竜騎士の英雄譚 パンジャール猟兵団戦記,,サイゴノリュウキシノエイユウタンパンジャールリョウヘイダンセンキ,ＫＡＤＯＫＡＷＡ（ＭＦ）,カドカワメディアファクトリー,蒼木雅彦,アオキマサヒコ,よしふみ,原作,ＭＦＣ,,,1,2023/02/22,4-04-681849-2,9784046818492,650,202302-095,2023/03/22,2026/02/21,,他,0
B2,聖母の鎖,双葉社,金子節子,,3,,,,131994,1,62,,131994,B2,聖母の鎖,,セイボノクサリ,双葉社,フタバシャ,金子節子,カネコセツコ,,,ジュールコミックス,,,1,2016/12/17,4-575-33650-5,9784575336504,680,53617-09,2017/01/17,,許諾,他,26855
B1,将来結婚しようね、と約束した幼馴染が剣聖になって帰ってきた,スターツ出版,コボリヤスヒラ,,6,,,,159638,1,63,,159638,B1,将来結婚しようね、と約束した幼馴染が剣聖になって帰ってきた,,ショウライケッコンシヨウネトヤクソクシタオサナナジミガケンセイニナッテカエッテキタ,スターツ出版,スターツシュッパン,コボリヤスヒラ,コボリヤスヒラ,深山鈴,原作,グラストＣＯＭＩＣＳ,,,1,2022/09/22,4-8137-6134-8,9784813761341,650,202209-250,2022/10/26,,許諾,他,0
B2,イジワル同居人は御曹司！？,スターツ出版,三星マユハ,,3,,,,169669,1,64,,169669,B2,イジワル同居人は御曹司！？,,イジワルドウキョニンハオンゾウシ,スターツ出版,スターツシュッパン,三星マユハ,ミホシマユハ,悠木にこら,原作,ベリーズコミックス,,,1,2024/11/15,4-8137-6378-2,9784813763789,660,202411-030,2024/12/18,,許諾,他,0
B1,万年２位だからと勘当された少年、無自覚に無双する,スクウェア・エニックス,大慈,,4,,,,153708,1,65,,153708,B1,万年２位だからと勘当された少年、無自覚に無双する,,マンネンニイダカラトカンドウサレタショウネンムジカクニムソウスル,スクウェア・エニックス,スクウェアエニックス,大慈,ダイジ,あざね,原作,ＧＣＵＰ！,,,1,2021/06/07,4-7575-7301-4,9784757573017,600,48147-16,2021/07/07,,許諾,他,0
B1,唯一無二の最強テイマー,一二三書房,田村紘一,,4,,,,159042,1,66,,159042,B1,唯一無二の最強テイマー,,ユイイツムニノサイキョウテイマー,一二三書房,ヒフミショボウ,田村紘一,タムラコウイチ,,,ノヴァコミックス,,,1,2022/07/20,4-89199-831-8,9784891998318,680,202207-813,2022/08/20,,許諾,他,0
B1,幸運値９９９の私、【即死魔法】が絶対に成功するので世界最強です,スターツ出版,日暮,,5,,,,160390,1,67,,160390,B1,幸運値９９９の私、【即死魔法】が絶対に成功するので世界最強です,,コウウンチキュウヒャクキュウジュウキュウノワタシソクシマホウガゼッタイニセイコウスルノデセカイサイキョウデス,スターツ出版,スターツシュッパン,日暮,ヒグラシ,万野みずき,原作,,,,1,2022/11/25,4-8137-6145-3,9784813761457,650,202211-243,2022/12/28,,許諾,他,0
B2,二世の契り,講談社,櫻井しゅしゅしゅ,,4,,,,103036,1,68,,103036,B2,二世の契り,,ニセイノチギリ,講談社,コウダンシャ,櫻井しゅしゅしゅ,サクライシュシュシュ,,,ＫＣ×ＡＲＩＡ,ＡＲＩＡ,,1,2011/03/07,4-06-380505-0,9784063805055,562,42900-05,2011/04/07,,許諾,BG,16069
S2,素肌で革命,小学館,樹本祐季,,8,,,,10824,1,69,,10824,S2,素肌で革命,,スハダデレボリューション,小学館,ショウガクカン,樹本祐季,キモトユウキ,,,フラワーコミックス〔Ｃｈｅｅｓｅ！〕,Ｃｈｅｅｓｅ！,,1,1998/05/26,4-09-137424-7,9784091374240,390,,2006/07/01,,許諾,SZ,742
B2,大切を押し付けられた聖女,リブレ,ホームラン・拳,,3,,,,161918,1,70,,161918,B2,大切を押し付けられた聖女,,タイセツヲオシツケラレタセイジョ,リブレ,リブレシュッパン,ホームラン・拳,ホームランケン,雪兎ざっく,原作,クロフネＣＯＭＩＣＳ　くろふねピクシブシリーズ,,,1,2023/03/20,4-7997-6193-5,9784799761939,725,54778-85,2023/10/01,,許諾,他,0
B1,究極のシェフは美味しんぼパパ,光文社,遊人,,3,,,,33630,1,71,,33630,B1,究極のシェフは美味しんぼパパ,,キュウキョクノシェフハオイシンボパパ,光文社,コウブンシャ,遊人,ユウジン,,,光文社コミックス,,,1,1989/03,4-334-80066-1,9784334800666,553,,,,,他,0
