僕儍儞儖,僞僀僩儖,弌斉幮,挊幰,姰寢,姫悢,俬俽俛俶,扞斣,僐儊儞僩,僐儈噦,嶜悢,楢斣,暋悢,俠俶俷,僕儍儞儖,僞僀僩儖,暃戣,僞僀僩儖僇僫,弌斉幮,弌斉幮僇僫,挊幰,挊幰僇僫,尨嶌幰,嬫暘,僔儕乕僘,嶨帍柤,姰寢,姫悢,敪攧擔,俬俽俛俶,俬俽俛俶侾俁,杮懱壙奿,嶨帍僐乕僪,嫋戻擔,廔椆擔,嫋戻,斕攧儔儞僋,傎傫偺偒傕偪
B1,嬎扟偝傫 偪傚偭偦傟怘偆傫偡偐両丠,憃梩幮,傐傫偲偛偨傫偩,,21,,,,130874,1,1,,130874,B1,嬎扟偝傫 偪傚偭偦傟怘偆傫偡偐両丠,,僉儕僞僯僒儞僠儑僢僜儗僋僂儞僗僇,憃梩幮,僼僞僶僔儍,傐傫偲偛偨傫偩,億儞僩僑僞儞僟,,,傾僋僔儑儞僐儈僢僋僗,枱夋傾僋僔儑儞,楢嵹拞,1,2016/09/12,4-575-84847-6,9784575848472,620,50194-86,2016/10/12,,嫋戻,懠,26331
B1,摰偪傖傫偼恖尒抦傝,廐揷彂揦,壞奀偪傚傝偡偗,,12,,,,144096,1,2,,144096,B1,摰偪傖傫偼恖尒抦傝,,僸僩儈僠儍儞僴僸僩儈僔儕,廐揷彂揦,傾僉僞僔儑僥儞,壞奀偪傚傝偡偗,僫僣儈僠儑儕僗働,,,僠儍儞僺僆儞俼俤俢僐儈僢僋僗,,,1,2019/05/20,4-253-23951-X,9784253239516,600,44948-31,2019/06/20,,嫋戻,懠,0
B1,婅偄傪姁偊偰傕傜偍偆偲埆杺傪彚姭偟偨偗偳丄壜垽偐偭偨偺偱寢崶偟傑偟偨 乣埆杺偺怴嵢乣,傾乕僗丒僗僞乕僄儞僞乕僥僀儊儞僩,偲側傝偗傞,,12,,,,151399,1,3,,151399,B1,婅偄傪姁偊偰傕傜偍偆偲埆杺傪彚姭偟偨偗偳丄壜垽偐偭偨偺偱寢崶偟傑偟偨 乣埆杺偺怴嵢乣,,僱僈僀儝僇僫僄僥儌儔僆僂僩傾僋儅儝僔儑僂僇儞僔僞働儗僪僇儚僀僇僢僞僲僨働僢僐儞僔儅僔僞傾僋儅僲僯僀僤儅,傾乕僗丒僗僞乕僄儞僞乕僥僀儊儞僩,傾乕僗僗僞乕僄儞僞乕僥僀儊儞僩,偲側傝偗傞,僩僫儕働儖,倱倛倝倰倷倳,尨嶌,傾乕僗丒僗僞乕僐儈僢僋僗,,,1,2020/12/11,4-8030-1471-X,9784803014716,600,202012-053,2021/07/28,,嫋戻,懠,0
B1,倀値値倎倣倕倓 俵倕倣倧倰倷,俲俙俢俷俲俙倂俙乮俙俵倂乯,墇悈僫僆僉,,10,,,,153001,1,4,,153001,B1,倀値値倎倣倕倓 俵倕倣倧倰倷,,傾儞僱乕儉僪儊儌儕乕,俲俙俢俷俲俙倂俙乮俙俵倂乯,僇僪僇儚傾僗僉乕儊僨傿傾儚乕僋僗,墇悈僫僆僉,僐僔儈僘僫僆僉,屆媨嬨帪,尨嶌,揹寕僐儈僢僋僗俶俤倃俿,揹寕戝墹,楢嵹拞,1,2021/04/09,4-04-913712-7,9784049137125,690,202104-052,2021/05/09,2027/04/08,嫋戻,懠,0
B1,彈憰偟偰傔傫偳偔偝偄帠偵側偭偰傞僱僋儔偲儎儞僉乕偺椉曅憐偄,儅僢僌僈乕僨儞,偲偍傞,,15,,,,143074,1,5,,143074,B1,彈憰偟偰傔傫偳偔偝偄帠偵側偭偰傞僱僋儔偲儎儞僉乕偺椉曅憐偄,,僕儑僜僂僔僥儊儞僪僋僒僀僐僩僯僫僢僥儖僱僋儔僩儎儞僉乕僲儕儑僂僇僞僆儌僀,儅僢僌僈乕僨儞,儅僢僌僈乕僨儞,偲偍傞,僩僆儖,,,僽儗僀僪僐儈僢僋僗僺僋僔僽,,,1,2019/02/09,4-8000-0829-8,9784800008299,600,53941-30,2019/03/09,,嫋戻,懠,0
B1,堎悽奅晄椣俀乣摫偐傟偟恖嵢偨偪偲晄婍梡揮惗桬幰乣,彫妛娰,偄偺傑傞,,9,,,,158099,1,6,,158099,B1,堎悽奅晄椣俀乣摫偐傟偟恖嵢偨偪偲晄婍梡揮惗桬幰乣,,僀僙僇僀僼儕儞俀,彫妛娰,僔儑僂僈僋僇儞,偄偺傑傞,僀僲儅儖,戝堜徆榓,尨嶌,栭僒儞僨乕俽俽俠,,,1,2022/05/12,4-09-851135-5,9784098511358,650,58511-35,2022/06/12,,嫋戻,懠,0
B1,惈怘婼 俙倢倝倕値倱 俵倕倕倲 俧倝倰倢倱,廐揷彂揦,埥廫偣偹偐,,7,,,,148709,1,7,,148709,B1,惈怘婼 俙倢倝倕値倱 俵倕倕倲 俧倝倰倢倱,,僙僀僔儑僋僉僄僀儕傾儞僘儈乕僩僈乕儖僘,廐揷彂揦,傾僉僞僔儑僥儞,埥廫偣偹偐,傾儖僩僙僱僇,堫岝怢擇,尨嶌,儎儞僌僠儍儞僺僆儞丒僐儈僢僋僗,,,1,2020/05/20,4-253-30101-0,9784253301015,630,56028-38,2020/06/20,,嫋戻,懠,0
B1,儕價儖僪儚乕儖僪,俲俙俢俷俲俙倂俙乮俙俵倂乯,埢懞愗恖,,16,,,,146855,1,8,,146855,B1,儕價儖僪儚乕儖僪,,儕價儖僪儚乕儖僪,俲俙俢俷俲俙倂俙乮俙俵倂乯,僇僪僇儚傾僗僉乕儊僨傿傾儚乕僋僗,埢懞愗恖,傾儎儉儔僉儕僸僩,僫僼僙,尨嶌,揹寕僐儈僢僋僗俶俤倃俿,揹寕儅僆僂,楢嵹拞,1,2019/12/27,4-04-912933-7,9784049129335,650,201912-134,2020/01/27,2028/12/26,嫋戻,懠,0
B1,僟儞僾丒僓丒僸乕儖,彫妛娰,尨廏懃,,5,,,,156933,1,9,,156933,B1,僟儞僾丒僓丒僸乕儖,,僟儞僾僓僸乕儖,彫妛娰,僔儑僂僈僋僇儞,尨廏懃,僴儔僸僨僲儕,僟儞僾徏杮丒暯捤夒恖,尨埬,價僢僌僐儈僢僋僗,價僢僌僐儈僢僋,楢嵹拞,1,2022/02/28,4-09-861249-6,9784098612499,591,58612-49,2022/03/28,,嫋戻,懠,0
B1,嶰廫楬昦偺塖,朏暥幮,壨忋偩偄偟傠偆,,7,,,,155519,1,10,,155519,B1,嶰廫楬昦偺塖,,儈僜僕價儑僂僲僂僞,朏暥幮,儂僂僽儞僔儍,壨忋偩偄偟傠偆,僇儚僇儈僟僀僔儘僂,,,朏暥幮僐儈僢僋僗,,,1,2021/10/14,4-8322-3866-3,9784832238664,620,50531-78,2021/11/14,,嫋戻,懠,0
